{
  "schema_version": "1.0.0",
  "repository": "https://github.com/SonSangjoon/coffee-chat",
  "target": {
    "repository": "https://github.com/SonSangjoon/coffee-chat",
    "version": "1.1.0",
    "release_digest": "sha256:721573b91fe197d16c945c2b1f102228deeb2d6b0f3050eae215964d63a6b2d2"
  },
  "registry_digest": "sha256:92d08686a73e43e1c842a739f2f6d0018fca5995c12a6d55f5f597b31c4954c3",
  "reference_schemas": {
    "release": {
      "path": "./references/engine-release.schema.json",
      "digest": "sha256:8e9a1edbc18c77f2003b73e8037ce07eec96bfa62b7bc0fb1248595bf92772e4"
    },
    "migration_registry": {
      "path": "./references/engine-migration-registry.schema.json",
      "digest": "sha256:f88958aea890636a48053ead87d2b0d94d384020f197275c66e10d84ee46397f"
    },
    "advisory": {
      "path": "./references/engine-update-advisory.schema.json",
      "digest": "sha256:adb3dd0de5b638d29bddda4b5fc11e54eada5df716682f9d483ea7943272d029"
    },
    "migration_document": {
      "path": "./references/engine-migration-document.schema.json",
      "digest": "sha256:a74716a3d8bd1b0aac8a5fa7ff475208487f575c99b25fd72f3bd20741a26a5a"
    }
  },
  "candidates": []
}
